A2: If your Printing Budget is: | B2: US$ 100 | D2: US$ 200 | F2: US$ 500 | H2: US$ 1000 | J2: US$ 2000
A3: And the number of Pages on you Guide is: | B3: You get this many copies (units) of your guide | C3: unit cost | D3: You get this many copies (units) of your guide | E3: unit cost | F3: You get this many copies (units) of your guide | G3: unit cost | H3: You get this many copies (units) of your guide | I3: unit cost | J3: You get this many copies (units) of your guide | K3: unit cost
A4: 1 to 4* | B4: 400 | C4: =B21 -> 0.25 | D4: =B4*2.5 -> 1000 | E4: =D21 -> 0.2 | F4: =B4*9 -> 3600 | G4: =F21 -> 0.1388888888888889 | H4: =B4*25 -> 10000 | I4: =H21 -> 0.1 | J4: =B4*70 -> 28000 | K4: =J21 -> 7.1428571428571425E-2
A5: 5 to 8* | B5: 200 | C5: =B22 -> 0.5 | D5: =B5*2.5 -> 500 | E5: =D22 -> 0.4 | F5: =B5*9 -> 1800 | G5: =F22 -> 0.27777777777777779 | H5: =B5*25 -> 5000 | I5: =H22 -> 0.2 | J5: =B5*70 -> 14000 | K5: =J22 -> 0.14285714285714285
A6: 9 to 12* | B6: 130 | C6: =B23 -> 0.76923076923076927 | D6: =B6*2.5 -> 325 | E6: =D23 -> 0.61538461538461542 | F6: =B6*9 -> 1170 | G6: =F23 -> 0.42735042735042733 | H6: =B6*25 -> 3250 | I6: =H23 -> 0.30769230769230771 | J6: =B6*70 -> 9100 | K6: =J23 -> 0.21978021978021978
A7: 13 to 16* | B7: 90 | C7: =B24 -> 1.1111111111111112 | D7: =B7*2.5 -> 225 | E7: =D24 -> 0.88888888888888884 | F7: =B7*9 -> 810 | G7: =F24 -> 0.61728395061728392 | H7: =B7*25 -> 2250 | I7: =H24 -> 0.44444444444444442 | J7: =B7*70 -> 6300 | K7: =J24 -> 0.31746031746031744
A8: 17 to 20* | B8: 70 | C8: =B25 -> 1.4285714285714286 | D8: =B8*2.5 -> 175 | E8: =D25 -> 1.1428571428571428 | F8: =B8*9 -> 630 | G8: =F25 -> 0.79365079365079361 | H8: =B8*25 -> 1750 | I8: =H25 -> 0.5714285714285714 | J8: =B8*70 -> 4900 | K8: =J25 -> 0.40816326530612246
A9: 21 to 24* | B9: 58 | C9: =B26 -> 1.7241379310344827 | D9: =B9*2.5 -> 145 | E9: =D26 -> 1.3793103448275863 | F9: =B9*9 -> 522 | G9: =F26 -> 0.95785440613026818 | H9: =B9*25 -> 1450 | I9: =H26 -> 0.68965517241379315 | J9: =B9*70 -> 4060 | K9: =J26 -> 0.49261083743842365
A10: 25 to 32 | B10: 43 | C10: =B27 -> 2.3255813953488373 | D10: =B10*2.5 -> 107.5 | E10: =D27 -> 1.8604651162790697 | F10: =B10*9 -> 387 | G10: =F27 -> 1.2919896640826873 | H10: =B10*25 -> 1075 | I10: =H27 -> 0.93023255813953487 | J10: =B10*70 -> 3010 | K10: =J27 -> 0.66445182724252494
A11: 33 to 40 | B11: 34 | C11: =B28 -> 2.9411764705882355 | D11: =B11*2.5 -> 85 | E11: =D28 -> 2.3529411764705883 | F11: =B11*9 -> 306 | G11: =F28 -> 1.6339869281045751 | H11: =B11*25 -> 850 | I11: =H28 -> 1.1764705882352942 | J11: =B11*70 -> 2380 | K11: =J28 -> 0.84033613445378152
A12: 41 to 48 | B12: 28 | C12: =B29 -> 3.5714285714285716 | D12: =B12*2.5 -> 70 | E12: =D29 -> 2.8571428571428572 | F12: =B12*9 -> 252 | G12: =F29 -> 1.9841269841269842 | H12: =B12*25 -> 700 | I12: =H29 -> 1.4285714285714286 | J12: =B12*70 -> 1960 | K12: =J29 -> 1.0204081632653061
A13: 49 to 56 | B13: 24 | C13: =B30 -> 4.166666666666667 | D13: =B13*2.5 -> 60 | E13: =D30 -> 3.3333333333333335 | F13: =B13*9 -> 216 | G13: =F30 -> 2.3148148148148149 | H13: =B13*25 -> 600 | I13: =H30 -> 1.6666666666666667 | J13: =B13*70 -> 1680 | K13: =J30 -> 1.1904761904761905
A14: 57 to 64 | B14: 21 | C14: =B31 -> 4.7619047619047619 | D14: =B14*2.5 -> 52.5 | E14: =D31 -> 3.8095238095238093 | F14: =B14*9 -> 189 | G14: =F31 -> 2.6455026455026456 | H14: =B14*25 -> 525 | I14: =H31 -> 1.9047619047619047 | J14: =B14*70 -> 1470 | K14: =J31 -> 1.3605442176870748
A15: 64 to 72 | B15: 18 | C15: =B32 -> 5.5555555555555554 | D15: =B15*2.5 -> 45 | E15: =D32 -> 4.4444444444444446 | F15: =B15*9 -> 162 | G15: =F32 -> 3.0864197530864197 | H15: =B15*25 -> 450 | I15: =H32 -> 2.2222222222222223 | J15: =B15*70 -> 1260 | K15: =J32 -> 1.5873015873015872
A16: 73 to 80 | B16: 16 | C16: =B33 -> 6.25 | D16: =B16*2.5 -> 40 | E16: =D33 -> 5 | F16: =B16*9 -> 144 | G16: =F33 -> 3.4722222222222223 | H16: =B16*25 -> 400 | I16: =H33 -> 2.5 | J16: =B16*70 -> 1120 | K16: =J33 -> 1.7857142857142858
A17: 81 to 88 | B17: 14 | C17: =B34 -> 7.1428571428571432 | D17: =B17*2.5 -> 35 | E17: =D34 -> 5.7142857142857144 | F17: =B17*9 -> 126 | G17: =F34 -> 3.9682539682539684 | H17: =B17*25 -> 350 | I17: =H34 -> 2.8571428571428572 | J17: =B17*70 -> 980 | K17: =J34 -> 2.0408163265306123
A18: 89 to 96 | B18: 12 | C18: =B35 -> 8.3333333333333339 | D18: =B18*2.5 -> 30 | E18: =D35 -> 6.666666666666667 | F18: =B18*9 -> 108 | G18: =F35 -> 4.6296296296296298 | H18: =B18*25 -> 300 | I18: =H35 -> 3.3333333333333335 | J18: =B18*70 -> 840 | K18: =J35 -> 2.3809523809523809

A1: USD134.00 - $100 worth of Booklets + US$ Shipping USD256.00 - $200 worth of Booklets + US$ Shipping USD597.00 - $500 worth of Booklets + US$ Shipping USD1,172.00 - $1000 worth of Booklets + US$ Shipping USD2,310.00 - $2000 worth of Booklets + US$ Shipping